[
  {
    "id": "talk-1",
    "title": "Talk 1",
    "abstract": "Abstract 1",
    "speaker_ids": ["speaker-1"],
    "level": "Beginner",
    "perspective": "Introduction",
    "tech_tags": ["Web", "Mobile"],
    "is_keynote": false
  },
  {
    "id": "talk-2",
    "title": "Talk 2",
    "abstract": "Abstract 2",
    "speaker_ids": ["speaker-2"],
    "level": "Intermediate",
    "perspective": "Experience",
    "tech_tags": ["Cloud", "AI"],
    "is_keynote": false
  },
  {
    "id": "talk-3",
    "title": "Talk 3",
    "abstract": "Abstract 3",
    "speaker_ids": ["speaker-3"],
    "level": "Advanced",
    "perspective": "Challenge",
    "tech_tags": ["Machine Learning", "Firebase"],
    "is_keynote": false
  },
  {
    "id": "talk-4",
    "title": "Talk 4",
    "abstract": "Abstract 4",
    "speaker_ids": ["speaker-4"],
    "level": "Beginner",
    "perspective": "Introduction",
    "tech_tags": ["Flutter", "Android"],
    "is_keynote": false
  },
  {
    "id": "talk-5",
    "title": "Talk 5",
    "abstract": "Abstract 5",
    "speaker_ids": ["speaker-5"],
    "level": "Intermediate",
    "perspective": "Experience",
    "tech_tags": ["Web", "Cloud"],
    "is_keynote": false
  },
  {
    "id": "talk-6",
    "title": "Talk 6",
    "abstract": "Abstract 6",
    "speaker_ids": ["speaker-6"],
    "level": "Advanced",
    "perspective": "Challenge",
    "tech_tags": ["AI", "Mobile"],
    "is_keynote": false
  },
  {
    "id": "talk-7",
    "title": "Talk 7",
    "abstract": "Abstract 7",
    "speaker_ids": ["speaker-7"],
    "level": "Beginner",
    "perspective": "Introduction",
    "tech_tags": ["Firebase", "Flutter"],
    "is_keynote": false
  },
  {
    "id": "talk-8",
    "title": "Talk 8",
    "abstract": "Abstract 8",
    "speaker_ids": ["speaker-8"],
    "level": "Intermediate",
    "perspective": "Experience",
    "tech_tags": ["Android", "Web"],
    "is_keynote": false
  },
  {
    "id": "talk-9",
    "title": "Talk 9",
    "abstract": "Abstract 9",
    "speaker_ids": ["speaker-9"],
    "level": "Advanced",
    "perspective": "Challenge",
    "tech_tags": ["Cloud", "Machine Learning"],
    "is_keynote": false
  },
  {
    "id": "talk-10",
    "title": "Talk 10",
    "abstract": "Abstract 10",
    "speaker_ids": ["speaker-10"],
    "level": "Beginner",
    "perspective": "Introduction",
    "tech_tags": ["AI", "Firebase"],
    "is_keynote": false
  },
  {
    "id": "talk-11",
    "title": "Talk 11",
    "abstract": "Abstract 11",
    "speaker_ids": ["speaker-11"],
    "level": "Intermediate",
    "perspective": "Experience",
    "tech_tags": ["Mobile", "Flutter"],
    "is_keynote": false
  },
  {
    "id": "talk-12",
    "title": "Talk 12",
    "abstract": "Abstract 12",
    "speaker_ids": ["speaker-12"],
    "level": "Advanced",
    "perspective": "Challenge",
    "tech_tags": ["Web", "Android"],
    "is_keynote": false
  }
]
